{
  "schemaVersion": 1,
  "moduleId": "origin-country",
  "attributeId": 4389,
  "status": "reference",
  "source": "Ozon description-category attribute values API (RU and ZH_HANS)",
  "complete": true,
  "values": [
    {
      "valueId": 90295,
      "displayZh": "俄罗斯",
      "targetValue": "Россия"
    },
    {
      "valueId": 90296,
      "displayZh": "中国",
      "targetValue": "Китай"
    },
    {
      "valueId": 90297,
      "displayZh": "未指定",
      "targetValue": "Не указана"
    },
    {
      "valueId": 90298,
      "displayZh": "意大利",
      "targetValue": "Италия"
    },
    {
      "valueId": 90299,
      "displayZh": "美国",
      "targetValue": "США"
    },
    {
      "valueId": 90300,
      "displayZh": "德国",
      "targetValue": "Германия"
    },
    {
      "valueId": 90302,
      "displayZh": "英国",
      "targetValue": "Великобритания"
    },
    {
      "valueId": 90303,
      "displayZh": "欧盟",
      "targetValue": "Европейский Союз"
    },
    {
      "valueId": 90304,
      "displayZh": "法国",
      "targetValue": "Франция"
    },
    {
      "valueId": 90305,
      "displayZh": "土耳其",
      "targetValue": "Турция"
    },
    {
      "valueId": 90306,
      "displayZh": "日本",
      "targetValue": "Япония"
    },
    {
      "valueId": 90307,
      "displayZh": "奥地利",
      "targetValue": "Австрия"
    },
    {
      "valueId": 90308,
      "displayZh": "苏联",
      "targetValue": "СССР"
    },
    {
      "valueId": 90309,
      "displayZh": "西班牙",
      "targetValue": "Испания"
    },
    {
      "valueId": 90310,
      "displayZh": "波兰",
      "targetValue": "Польша"
    },
    {
      "valueId": 90311,
      "displayZh": "韩国",
      "targetValue": "Корея"
    },
    {
      "valueId": 90312,
      "displayZh": "印度",
      "targetValue": "Индия"
    },
    {
      "valueId": 90313,
      "displayZh": "摩尔多瓦",
      "targetValue": "Молдова"
    },
    {
      "valueId": 90314,
      "displayZh": "加拿大",
      "targetValue": "Канада"
    },
    {
      "valueId": 90315,
      "displayZh": "巴西",
      "targetValue": "Бразилия"
    },
    {
      "valueId": 90316,
      "displayZh": "丹麦",
      "targetValue": "Дания"
    },
    {
      "valueId": 90317,
      "displayZh": "中国（台湾）",
      "targetValue": "Китай (Тайвань)"
    },
    {
      "valueId": 90318,
      "displayZh": "比利时",
      "targetValue": "Бельгия"
    },
    {
      "valueId": 90319,
      "displayZh": "乌克兰",
      "targetValue": "Украина"
    },
    {
      "valueId": 90320,
      "displayZh": "中国（香港）",
      "targetValue": "Китай (Гонконг)"
    },
    {
      "valueId": 90321,
      "displayZh": "捷克",
      "targetValue": "Чехия"
    },
    {
      "valueId": 90322,
      "displayZh": "瑞典",
      "targetValue": "Швеция"
    },
    {
      "valueId": 90323,
      "displayZh": "瑞士",
      "targetValue": "Швейцария"
    },
    {
      "valueId": 90324,
      "displayZh": "白俄罗斯",
      "targetValue": "Беларусь"
    },
    {
      "valueId": 90325,
      "displayZh": "荷兰",
      "targetValue": "Нидерланды"
    },
    {
      "valueId": 90326,
      "displayZh": "匈牙利",
      "targetValue": "Венгрия"
    },
    {
      "valueId": 90327,
      "displayZh": "芬兰",
      "targetValue": "Финляндия"
    },
    {
      "valueId": 90328,
      "displayZh": "泰国",
      "targetValue": "Таиланд"
    },
    {
      "valueId": 90329,
      "displayZh": "澳大利亚",
      "targetValue": "Австралия"
    },
    {
      "valueId": 90330,
      "displayZh": "葡萄牙",
      "targetValue": "Португалия"
    },
    {
      "valueId": 90331,
      "displayZh": "越南",
      "targetValue": "Вьетнам"
    },
    {
      "valueId": 90332,
      "displayZh": "荷兰",
      "targetValue": "Голландия"
    },
    {
      "valueId": 90333,
      "displayZh": "韩国",
      "targetValue": "Южная Корея"
    },
    {
      "valueId": 90334,
      "displayZh": "孟加拉国",
      "targetValue": "Бангладеш"
    },
    {
      "valueId": 90335,
      "displayZh": "斯洛文尼亚",
      "targetValue": "Словения"
    },
    {
      "valueId": 90336,
      "displayZh": "挪威",
      "targetValue": "Норвегия"
    },
    {
      "valueId": 90337,
      "displayZh": "印度尼西亚",
      "targetValue": "Индонезия"
    },
    {
      "valueId": 90338,
      "displayZh": "爱尔兰",
      "targetValue": "Ирландия"
    },
    {
      "valueId": 90339,
      "displayZh": "马来西亚",
      "targetValue": "Малайзия"
    },
    {
      "valueId": 90340,
      "displayZh": "以色列",
      "targetValue": "Израиль"
    },
    {
      "valueId": 90341,
      "displayZh": "罗马尼亚",
      "targetValue": "Румыния"
    },
    {
      "valueId": 90342,
      "displayZh": "保加利亚",
      "targetValue": "Болгария"
    },
    {
      "valueId": 90343,
      "displayZh": "塞尔维亚",
      "targetValue": "Сербия"
    },
    {
      "valueId": 90344,
      "displayZh": "希腊",
      "targetValue": "Греция"
    },
    {
      "valueId": 90345,
      "displayZh": "墨西哥",
      "targetValue": "Мексика"
    },
    {
      "valueId": 90346,
      "displayZh": "巴基斯坦",
      "targetValue": "Пакистан"
    },
    {
      "valueId": 90347,
      "displayZh": "菲律宾",
      "targetValue": "Филиппины"
    },
    {
      "valueId": 90348,
      "displayZh": "阿根廷",
      "targetValue": "Аргентина"
    },
    {
      "valueId": 90349,
      "displayZh": "乌兹别克斯坦",
      "targetValue": "Узбекистан"
    },
    {
      "valueId": 90350,
      "displayZh": "新西兰",
      "targetValue": "Новая Зеландия"
    },
    {
      "valueId": 90351,
      "displayZh": "拉托维亚",
      "targetValue": "Латвия"
    },
    {
      "valueId": 90352,
      "displayZh": "乍得",
      "targetValue": "Чад"
    },
    {
      "valueId": 90353,
      "displayZh": "约旦",
      "targetValue": "Иордания"
    },
    {
      "valueId": 90354,
      "displayZh": "哥伦比亚",
      "targetValue": "Колумбия"
    },
    {
      "valueId": 90355,
      "displayZh": "捷克斯洛伐克",
      "targetValue": "Чехословакия"
    },
    {
      "valueId": 90356,
      "displayZh": "德意志联邦共和国",
      "targetValue": "ФРГ"
    },
    {
      "valueId": 90357,
      "displayZh": "伊朗",
      "targetValue": "Иран"
    },
    {
      "valueId": 90358,
      "displayZh": "科特迪瓦",
      "targetValue": "Кот-д' Ивуар"
    },
    {
      "valueId": 90359,
      "displayZh": "马其顿",
      "targetValue": "Македония"
    },
    {
      "valueId": 90360,
      "displayZh": "南斯拉夫",
      "targetValue": "Югославия"
    },
    {
      "valueId": 90361,
      "displayZh": "爱沙尼亚",
      "targetValue": "Эстония"
    },
    {
      "valueId": 90362,
      "displayZh": "斯洛伐克",
      "targetValue": "Словакия"
    },
    {
      "valueId": 90363,
      "displayZh": "马达加斯加",
      "targetValue": "Мадагаскар"
    },
    {
      "valueId": 90364,
      "displayZh": "哈萨克斯坦",
      "targetValue": "Казахстан"
    },
    {
      "valueId": 90365,
      "displayZh": "突尼斯",
      "targetValue": "Тунис"
    },
    {
      "valueId": 90366,
      "displayZh": "马里",
      "targetValue": "Мали"
    },
    {
      "valueId": 90367,
      "displayZh": "吉布提",
      "targetValue": "Джибути"
    },
    {
      "valueId": 90368,
      "displayZh": "贝宁",
      "targetValue": "Бенин"
    },
    {
      "valueId": 90369,
      "displayZh": "柬埔寨",
      "targetValue": "Камбоджа"
    },
    {
      "valueId": 90370,
      "displayZh": "立陶宛",
      "targetValue": "Литва"
    },
    {
      "valueId": 90371,
      "displayZh": "莫桑比克",
      "targetValue": "Мозамбик"
    },
    {
      "valueId": 90372,
      "displayZh": "冰岛",
      "targetValue": "Исландия"
    },
    {
      "valueId": 90373,
      "displayZh": "古巴",
      "targetValue": "Куба"
    },
    {
      "valueId": 90374,
      "displayZh": "德意志民主共和国",
      "targetValue": "ГДР"
    },
    {
      "valueId": 90375,
      "displayZh": "牙买加",
      "targetValue": "Ямайка"
    },
    {
      "valueId": 90376,
      "displayZh": "新加坡",
      "targetValue": "Сингапур"
    },
    {
      "valueId": 90377,
      "displayZh": "南非",
      "targetValue": "ЮАР"
    },
    {
      "valueId": 90378,
      "displayZh": "卢森堡",
      "targetValue": "Люксембург"
    },
    {
      "valueId": 90379,
      "displayZh": "埃及",
      "targetValue": "Египет"
    },
    {
      "valueId": 90380,
      "displayZh": "阿联酋",
      "targetValue": "ОАЭ"
    },
    {
      "valueId": 90381,
      "displayZh": "格鲁吉亚",
      "targetValue": "Грузия"
    },
    {
      "valueId": 90382,
      "displayZh": "几内亚共和国",
      "targetValue": "Гвинейская Р-ка"
    },
    {
      "valueId": 90383,
      "displayZh": "秘鲁",
      "targetValue": "Перу"
    },
    {
      "valueId": 90384,
      "displayZh": "科摩罗群岛",
      "targetValue": "Коморские о-ва"
    },
    {
      "valueId": 90385,
      "displayZh": "斯里兰卡",
      "targetValue": "Шри-Ланка"
    },
    {
      "valueId": 90386,
      "displayZh": "塞浦路斯",
      "targetValue": "Кипр"
    },
    {
      "valueId": 90387,
      "displayZh": "卢旺达",
      "targetValue": "Руанда"
    },
    {
      "valueId": 90388,
      "displayZh": "摩洛哥",
      "targetValue": "Марокко"
    },
    {
      "valueId": 90389,
      "displayZh": "克罗地亚",
      "targetValue": "Хорватия"
    },
    {
      "valueId": 90390,
      "displayZh": "摩纳哥",
      "targetValue": "Монако"
    },
    {
      "valueId": 90391,
      "displayZh": "蒙古",
      "targetValue": "Монголия"
    },
    {
      "valueId": 90392,
      "displayZh": "加蓬",
      "targetValue": "Габон"
    },
    {
      "valueId": 90393,
      "displayZh": "刚果",
      "targetValue": "Конго"
    },
    {
      "valueId": 90394,
      "displayZh": "尼泊尔",
      "targetValue": "Непал"
    },
    {
      "valueId": 90395,
      "displayZh": "亚美尼亚",
      "targetValue": "Армения"
    },
    {
      "valueId": 90396,
      "displayZh": "多哥",
      "targetValue": "Того"
    },
    {
      "valueId": 90397,
      "displayZh": "叙利亚",
      "targetValue": "Сирия"
    },
    {
      "valueId": 90398,
      "displayZh": "布隆迪",
      "targetValue": "Бурунди"
    },
    {
      "valueId": 90399,